"sentence,tense,aspect"
Adam discovered the comet,past simple,perfect
Karen has agreed to the terms,present perfect,perfect
Karen is negotiating the terms,present progressive,progressive
Karen was negotiating the terms,past progressive,progressive
Karen has negotiated the terms,present perfect,perfect
Karen had negotiated the terms,past perfect,perfect
Karen will negotiate the terms,future simple,progressive
Karen negotiates the terms,present simple,progressive
Karen negotiated the terms,past simple,perfect
Karen had agreed to the terms,past perfect,perfect
Karen will agree to the terms,future simple,progressive
Karen agrees to the terms,present simple,progressive
Karen agreed to the terms,past simple,perfect
Tom is purchasing the car,present progressive,progressive
Tom has owned the car,present perfect,perfect
Tom had owned the car,past perfect,perfect
Tom will own the car,future simple,progressive
Tom owns the car,present simple,progressive
Tom owned the car,past simple,perfect
Tom was purchasing the car,past progressive,progressive
Tom has purchased the car,present perfect,perfect
Tom had purchased the car,past perfect,perfect
Tom will purchase the car,future simple,progressive
Tom purchases the car,present simple,progressive
Tom purchased the car,past simple,perfect
Nick is buying the house,present progressive,progressive
Nick has had the house,present perfect,perfect
Nick had had the house,past perfect,perfect
Nick will have the house,future simple,progressive
Nick has the house,present simple,progressive
Nick had the house,past simple,perfect
Nick was buying the house,past progressive,progressive
Nick has bought the house,present perfect,perfect
Nick had bought the house,past perfect,perfect
Nick will buy the house,future simple,progressive
Nick buys the house,present simple,progressive
Nick bought the house,past simple,perfect
The farmer has owned the crops,present perfect,perfect
The farmer had owned the crops,past perfect,perfect
The farmer will own the crops,future simple,progressive
The farmer owns the crops,present simple,progressive
The farmer owned the crops,past simple,perfect
The ambulance is acting on the emergency,present progressive,progressive
The ambulance is responding to the emergency,present progressive,progressive
The ambulance was responding to the emergency,past progressive,progressive
The ambulance has responded to the emergency,present perfect,perfect
The ambulance had responded to the emergency,past perfect,perfect
The ambulance will respond to the emergency,future simple,progressive
The ambulance responds to the emergency,present simple,progressive
The ambulance responded to the emergency,past simple,perfect
The ambulance was acting on the emergency,past progressive,progressive
The ambulance has acted on the emergency,present perfect,perfect
The ambulance had acted on the emergency,past perfect,perfect
The ambulance will act on the emergency,future simple,progressive
The ambulance acts on the emergency,present simple,progressive
The ambulance acted on the emergency,past simple,perfect
Cory is meeting with John,present progressive,progressive
Cory is discussing with John,present progressive,progressive
Cory was discussing with John,past progressive,progressive
Cory has discussed with John,present perfect,perfect
Cory had discussed with John,past perfect,perfect
Cory will discuss with John,future simple,progressive
Cory discusses with John,present simple,progressive
Cory discussed with John,past simple,perfect
Cory was meeting with John,past progressive,progressive
Cory has met with John,present perfect,perfect
Cory had met with John,past perfect,perfect
Cory will meet with John,future simple,progressive
Cory meets with John,present simple,progressive
Cory met with John,past simple,perfect
Bill is departing from London,present progressive,progressive
Bill is visiting London,present progressive,progressive
Bill was visiting London,past progressive,progressive
Bill has visited London,present perfect,perfect
Bill had visited London,past perfect,perfect
Bill will visit London,future simple,progressive
Bill visits London,present simple,progressive
Bill visited London,past simple,perfect
Bill was departing from London,past progressive,progressive
Bill has departed from London,present perfect,perfect
Bill had departed from London,past perfect,perfect
Bill will depart from London,future simple,progressive
Bill departs from London,present simple,progressive
Bill departed from London,past simple,perfect
Airbus is producing the engine,present progressive,progressive
Airbus is shipping the engine,present progressive,progressive
Airbus was shipping the engine,past progressive,progressive
Airbus has shipped the engine,present perfect,perfect
Airbus had shipped the engine,past perfect,perfect
Airbus will ship the engine,future simple,progressive
Airbus ships the engine,present simple,progressive
Airbus shipped the engine,past simple,perfect
Airbus was producing the engine,past progressive,progressive
Airbus has produced the engine,present perfect,perfect
Airbus had produced the engine,past perfect,perfect
Airbus will produce the engine,future simple,progressive
Airbus produces the engine,present simple,progressive
Airbus produced the engine,past simple,perfect
Mary has had the letter,present perfect,perfect
Mary is collecting the letter,present progressive,progressive
Mary was collecting the letter,past progressive,progressive
Mary has collected the letter,present perfect,perfect
Mary had collected the letter,past perfect,perfect
Mary will collect the letter,future simple,progressive
Mary collects the letter,present simple,progressive
Mary collected the letter,past simple,perfect
Mary had had the letter,past perfect,perfect
Mary will have the letter,future simple,progressive
Mary has the letter,present simple,progressive
Mary had the letter,past simple,perfect
The cat is catching the mouse,present progressive,progressive
The cat is chasing the mouse,present progressive,progressive
The cat was chasing the mouse,past progressive,progressive
The cat has chased the mouse,present perfect,perfect
The cat had chased the mouse,past perfect,perfect
The cat will chase the mouse,future simple,progressive
The cat chases the mouse,present simple,progressive
The cat chased the mouse,past simple,perfect
The cat was catching the mouse,past progressive,progressive
The cat has caught the mouse,present perfect,perfect
The cat had caught the mouse,past perfect,perfect
The cat will catch the mouse,future simple,progressive
The cat catches the mouse,present simple,progressive
The cat caught the mouse,past simple,perfect
Veloretti is producing the bicycle,present progressive,progressive
Veloretti has owned the bicycle,present perfect,perfect
Veloretti had owned the bicycle,past perfect,perfect
Veloretti will own the bicycle,future simple,progressive
Veloretti owns the bicycle,present simple,progressive
Veloretti owned the bicycle,past simple,perfect
Veloretti was producing the bicycle,past progressive,progressive
Veloretti has produced the bicycle,present perfect,perfect
Veloretti had produced the bicycle,past perfect,perfect
Veloretti will produce the bicycle,future simple,progressive
Veloretti produces the bicycle,present simple,progressive
Veloretti produced the bicycle,past simple,perfect
James is chewing on the sandwich,present progressive,progressive
James is eating the sandwich,present progressive,progressive
James was eating the sandwich,past progressive,progressive
James has eaten the sandwich,present perfect,perfect
James had eaten the sandwich,past perfect,perfect
James will eat the sandwich,future simple,progressive
James eats the sandwich,present simple,progressive
James ate the sandwich,past simple,perfect
James was chewing on the sandwich,past progressive,progressive
James has chewed on the sandwich,present perfect,perfect
James had chewed on the sandwich,past perfect,perfect
James will chew on the sandwich,future simple,progressive
James chews on the sandwich,present simple,progressive
James chewed on the sandwich,past simple,perfect
The farmer is milling corn,present progressive,progressive
The farmer is harvesting corn,present progressive,progressive
The farmer was harvesting corn,past progressive,progressive
The farmer has harvested corn,present perfect,perfect
The farmer had harvested corn,past perfect,perfect
The farmer will harvest corn,future simple,progressive
The farmer harvests corn,present simple,progressive
The farmer harvested corn,past simple,perfect
The farmer was milling corn,past progressive,progressive
The farmer has milled corn,present perfect,perfect
The farmer had milled corn,past perfect,perfect
The farmer will mill corn,future simple,progressive
The farmer mills corn,present simple,progressive
The farmer milled corn,past simple,perfect
Jenny is injuring Mary,present progressive,progressive
Jenny is attacking Mary,present progressive,progressive
Jenny was attacking Mary,past progressive,progressive
Jenny has attacked Mary,present perfect,perfect
Jenny had attacked Mary,past perfect,perfect
Jenny will attack Mary,future simple,progressive
Jenny attacks Mary,present simple,progressive
Jenny attacked Mary,past simple,perfect
Jenny was injuring Mary,past progressive,progressive
Jenny has injured Mary,present perfect,perfect
Jenny had injured Mary,past perfect,perfect
Jenny will injure Mary,future simple,progressive
Jenny injures Mary,present simple,progressive
Jenny injured Mary,past simple,perfect
The machine is rinsing the clothes,present progressive,progressive
The machine is soaking the clothes,present progressive,progressive
The machine was soaking the clothes,past progressive,progressive
The machine has soaked the clothes,present perfect,perfect
The machine had soaked the clothes,past perfect,perfect
The machine will soak the clothes,future simple,progressive
The machine soaks the clothes,present simple,progressive
The machine soaked the clothes,past simple,perfect
The machine was rinsing the clothes,past progressive,progressive
The machine has rinsed the clothes,present perfect,perfect
The machine had rinsed the clothes,past perfect,perfect
The machine will rinse the clothes,future simple,progressive
The machine rinses the clothes,present simple,progressive
The machine rinsed the clothes,past simple,perfect
John is wounding Jack,present progressive,progressive
John is attacking Jack,present progressive,progressive
John was attacking Jack,past progressive,progressive
John has attacked Jack,present perfect,perfect
John had attacked Jack,past perfect,perfect
John will attack Jack,future simple,progressive
John attacks Jack,present simple,progressive
John attacked Jack,past simple,perfect
John was wounding Jack,past progressive,progressive
John has wounded Jack,present perfect,perfect
John had wounded Jack,past perfect,perfect
John will wound Jack,future simple,progressive
John wounds Jack,present simple,progressive
John wounded Jack,past simple,perfect
Mitch is deciding on the issue,present progressive,progressive
Mitch is talking about the issue,present progressive,progressive
Mitch was talking about the issue,past progressive,progressive
Mitch has talked about the issue,present perfect,perfect
Mitch had talked about the issue,past perfect,perfect
Mitch will talk about the issue,future simple,progressive
Mitch talks about the issue,present simple,progressive
Mitch talked about the issue,past simple,perfect
Mitch was deciding on the issue,past progressive,progressive
Mitch has decided on the issue,present perfect,perfect
Mitch had decided on the issue,past perfect,perfect
Mitch will decide on the issue,future simple,progressive
Mitch decides on the issue,present simple,progressive
Mitch decided on the issue,past simple,perfect
Jim is retiring,present progressive,progressive
Jim is working,present progressive,progressive
Jim was working,past progressive,progressive
Jim has worked,present perfect,perfect
Jim had worked,past perfect,perfect
Jim will work,future simple,progressive
Jim works,present simple,progressive
Jim worked,past simple,perfect
Jim was retiring,past progressive,progressive
Jim has retired,present perfect,perfect
Jim had retired,past perfect,perfect
Jim will retire,future simple,progressive
Jim retires,present simple,progressive
Jim retired,past simple,perfect
Bill is dialling 911,present progressive,progressive
Bill is calling 911,present progressive,progressive
Bill was calling 911,past progressive,progressive
Bill has called 911,present perfect,perfect
Bill had called 911,past perfect,perfect
Bill will call 911,future simple,progressive
Bill calls 911,present simple,progressive
Bill called 911,past simple,perfect
Bill was dialling 911,past progressive,progressive
Bill has dialled 911,present perfect,perfect
Bill had dialled 911,past perfect,perfect
Bill will dial 911,future simple,progressive
Bill dials 911,present simple,progressive
Bill dialled 911,past simple,perfect
John is travelling to London,present progressive,progressive
John was travelling to London,past progressive,progressive
John has travelled to London,present perfect,perfect
John had travelled to London,past perfect,perfect
John will travel to London,future simple,progressive
John travels to London,present simple,progressive
John travelled to London,past simple,perfect
The farmer is planting corn,present progressive,progressive
The farmer was planting corn,past progressive,progressive
The farmer has planted corn,present perfect,perfect
The farmer had planted corn,past perfect,perfect
The farmer will plant corn,future simple,progressive
The farmer plants corn,present simple,progressive
The farmer planted corn,past simple,perfect
Andrew has died in Scotland,present perfect,perfect
Andrew has lived in Scotland,present perfect,perfect
Andrew had lived in Scotland,past perfect,perfect
Andrew will live in Scotland,future simple,progressive
Andrew lives in Scotland,present simple,progressive
Andrew lived in Scotland,past simple,perfect
Andrew had died in Scotland,past perfect,perfect
Andrew will die in Scotland,future simple,progressive
Andrew dies in Scotland,present simple,progressive
Andrew died in Scotland,past simple,perfect
Tim is marinating the food,present progressive,progressive
Tim is cooking the food,present progressive,progressive
Tim was cooking the food,past progressive,progressive
Tim has cooked the food,present perfect,perfect
Tim had cooked the food,past perfect,perfect
Tim will cook the food,future simple,progressive
Tim cooks the food,present simple,progressive
Tim cooked the food,past simple,perfect
Tim was marinating the food,past progressive,progressive
Tim has marinated the food,present perfect,perfect
Tim had marinated the food,past perfect,perfect
Tim will marinate the food,future simple,progressive
Tim marinates the food,present simple,progressive
Tim marinated the food,past simple,perfect
Tim is choosing the car,present progressive,progressive
Tim is comparing cars,present progressive,progressive
Tim was comparing cars,past progressive,progressive
Tim has compared cars,present perfect,perfect
Tim had compared cars,past perfect,perfect
Tim will compare cars,future simple,progressive
Tim compares cars,present simple,progressive
Tim compared cars,past simple,perfect
Tim was choosing the car,past progressive,progressive
Tim has chosen the car,present perfect,perfect
Tim had chosen the car,past perfect,perfect
Tim will choose the car,future simple,progressive
Tim chooses the car,present simple,progressive
Tim chose the car,past simple,perfect
Jill is patenting the device,present progressive,progressive
Jill is inventing the device,present progressive,progressive
Jill was inventing the device,past progressive,progressive
Jill has invented the device,present perfect,perfect
Jill had invented the device,past perfect,perfect
Jill will invent the device,future simple,progressive
Jill invents the device,present simple,progressive
Jill invented the device,past simple,perfect
Jill was patenting the device,past progressive,progressive
Jill has patented the device,present perfect,perfect
Jill had patented the device,past perfect,perfect
Jill will patent the device,future simple,progressive
Jill patents the device,present simple,progressive
Jill patented the device,past simple,perfect
Boeing is distributing the engine,present progressive,progressive
Boeing was distributing the engine,past progressive,progressive
Boeing has distributed the engine,present perfect,perfect
Boeing had distributed the engine,past perfect,perfect
Boeing will distribute the engine,future simple,progressive
Boeing distributes the engine,present simple,progressive
Boeing distributed the engine,past simple,perfect
Matt is editing the paper,present progressive,progressive
Matt is writing the paper,present progressive,progressive
Matt was writing the paper,past progressive,progressive
Matt has written the paper,present perfect,perfect
Matt had written the paper,past perfect,perfect
Matt will write the paper,future simple,progressive
Matt writes the paper,present simple,progressive
Matt wrote the paper,past simple,perfect
Matt was editing the paper,past progressive,progressive
Matt has edited the paper,present perfect,perfect
Matt had edited the paper,past perfect,perfect
Matt will edit the paper,future simple,progressive
Matt edits the paper,present simple,progressive
Matt edited the paper,past simple,perfect
Max is buying the flat,present progressive,progressive
Max has owned the flat,present perfect,perfect
Max had owned the flat,past perfect,perfect
Max will own the flat,future simple,progressive
Max owns the flat,present simple,progressive
Max owned the flat,past simple,perfect
Max was buying the flat,past progressive,progressive
Max has bought the flat,present perfect,perfect
Max had bought the flat,past perfect,perfect
Max will buy the flat,future simple,progressive
Max buys the flat,present simple,progressive
Max bought the flat,past simple,perfect
John is exiting London,present progressive,progressive
John was exiting London,past progressive,progressive
John has exited London,present perfect,perfect
John had exited London,past perfect,perfect
John will exit London,future simple,progressive
John exits London,present simple,progressive
John exited London,past simple,perfect
George is acquiring the house,present progressive,progressive
George has owned the house,present perfect,perfect
George had owned the house,past perfect,perfect
George will own the house,future simple,progressive
George owns the house,present simple,progressive
George owned the house,past simple,perfect
George was acquiring the house,past progressive,progressive
George has acquired the house,present perfect,perfect
George had acquired the house,past perfect,perfect
George will acquire the house,future simple,progressive
George acquires the house,present simple,progressive
George acquired the house,past simple,perfect
Lee is wounding the president,present progressive,progressive
Lee was wounding the president,past progressive,progressive
Lee has wounded the president,present perfect,perfect
Lee had wounded the president,past perfect,perfect
Lee will wound the president,future simple,progressive
Lee wounds the president,present simple,progressive
Lee wounded the president,past simple,perfect
John is reaching London,present progressive,progressive
John was reaching London,past progressive,progressive
John has reached London,present perfect,perfect
John had reached London,past perfect,perfect
John will reach London,future simple,progressive
John reaches London,present simple,progressive
John reached London,past simple,perfect
Andy is preparing the food,present progressive,progressive
Andy is cooking the food,present progressive,progressive
Andy was cooking the food,past progressive,progressive
Andy has cooked the food,present perfect,perfect
Andy had cooked the food,past perfect,perfect
Andy will cook the food,future simple,progressive
Andy cooks the food,present simple,progressive
Andy cooked the food,past simple,perfect
Andy was preparing the food,past progressive,progressive
Andy has prepared the food,present perfect,perfect
Andy had prepared the food,past perfect,perfect
Andy will prepare the food,future simple,progressive
Andy prepares the food,present simple,progressive
Andy prepared the food,past simple,perfect
Russia is invading Crimea,present progressive,progressive
Russia was invading Crimea,past progressive,progressive
Russia has invaded Crimea,present perfect,perfect
Russia had invaded Crimea,past perfect,perfect
Russia will invade Crimea,future simple,progressive
Russia invades Crimea,present simple,progressive
Russia invaded Crimea,past simple,perfect
Tom is paying for the coffee,present progressive,progressive
Tom is purchasing the coffee,present progressive,progressive
Tom was purchasing the coffee,past progressive,progressive
Tom has purchased the coffee,present perfect,perfect
Tom had purchased the coffee,past perfect,perfect
Tom will purchase the coffee,future simple,progressive
Tom purchases the coffee,present simple,progressive
Tom purchased the coffee,past simple,perfect
Tom was paying for the coffee,past progressive,progressive
Tom has paid for the coffee,present perfect,perfect
Tom had paid for the coffee,past perfect,perfect
Tom will pay for the coffee,future simple,progressive
Tom pays for the coffee,present simple,progressive
Tom paid for the coffee,past simple,perfect
The court is convicting the thief,present progressive,progressive
The court is imprisoning the thief,present progressive,progressive
The court was imprisoning the thief,past progressive,progressive
The court has imprisoned the thief,present perfect,perfect
The court had imprisoned the thief,past perfect,perfect
The court will imprison the thief,future simple,progressive
The court imprisons the thief,present simple,progressive
The court imprisoned the thief,past simple,perfect
The court was convicting the thief,past progressive,progressive
The court has convicted the thief,present perfect,perfect
The court had convicted the thief,past perfect,perfect
The court will convict the thief,future simple,progressive
The court convicts the thief,present simple,progressive
The court convicted the thief,past simple,perfect
Jane is exiting the shop,present progressive,progressive
Jane is entering the shop,present progressive,progressive
Jane was entering the shop,past progressive,progressive
Jane has entered the shop,present perfect,perfect
Jane had entered the shop,past perfect,perfect
Jane will enter the shop,future simple,progressive
Jane enters the shop,present simple,progressive
Jane entered the shop,past simple,perfect
Jane was exiting the shop,past progressive,progressive
Jane has exited the shop,present perfect,perfect
Jane had exited the shop,past perfect,perfect
Jane will exit the shop,future simple,progressive
Jane exits the shop,present simple,progressive
Jane exited the shop,past simple,perfect
Sam is acquiring the laptop,present progressive,progressive
Sam is paying for the laptop,present progressive,progressive
Sam was paying for the laptop,past progressive,progressive
Sam has paid for the laptop,present perfect,perfect
Sam had paid for the laptop,past perfect,perfect
Sam will pay for the laptop,future simple,progressive
Sam pays for the laptop,present simple,progressive
Sam paid for the laptop,past simple,perfect
Sam was acquiring the laptop,past progressive,progressive
Sam has acquired the laptop,present perfect,perfect
Sam had acquired the laptop,past perfect,perfect
Sam will acquire the laptop,future simple,progressive
Sam acquires the laptop,present simple,progressive
Sam acquired the laptop,past simple,perfect
