"sentence,tense,aspect"
France is conquering Belgium,present progressive,progressive
France is attacking Belgium,present progressive,progressive
France was attacking Belgium,past progressive,progressive
France has attacked Belgium,present perfect,perfect
France had attacked Belgium,past perfect,perfect
France will attack Belgium,future simple,progressive
France attacks Belgium,present simple,progressive
France attacked Belgium,past simple,perfect
France was conquering Belgium,past progressive,progressive
France has conquered Belgium,present perfect,perfect
France had conquered Belgium,past perfect,perfect
France will conquer Belgium,future simple,progressive
France conquers Belgium,present simple,progressive
France conquered Belgium,past simple,perfect
Amazon is shipping the parcel,present progressive,progressive
Amazon is bundling the parcel,present progressive,progressive
Amazon was bundling the parcel,past progressive,progressive
Amazon has bundled the parcel,present perfect,perfect
Amazon had bundled the parcel,past perfect,perfect
Amazon will bundle the parcel,future simple,progressive
Amazon bundles the parcel,present simple,progressive
Amazon bundled the parcel,past simple,perfect
Amazon was shipping the parcel,past progressive,progressive
Amazon has shipped the parcel,present perfect,perfect
Amazon had shipped the parcel,past perfect,perfect
Amazon will ship the parcel,future simple,progressive
Amazon ships the parcel,present simple,progressive
Amazon shipped the parcel,past simple,perfect
Austria is attacking Serbia,present progressive,progressive
Austria is bombing Serbia,present progressive,progressive
Austria was bombing Serbia,past progressive,progressive
Austria has bombed Serbia,present perfect,perfect
Austria had bombed Serbia,past perfect,perfect
Austria will bomb Serbia,future simple,progressive
Austria bombs Serbia,present simple,progressive
Austria bombed Serbia,past simple,perfect
Austria was attacking Serbia,past progressive,progressive
Austria has attacked Serbia,present perfect,perfect
Austria had attacked Serbia,past perfect,perfect
Austria will attack Serbia,future simple,progressive
Austria attacks Serbia,present simple,progressive
Austria attacked Serbia,past simple,perfect
Google is hiring Thomas,present progressive,progressive
Google is interviewing Thomas,present progressive,progressive
Google was interviewing Thomas,past progressive,progressive
Google has interviewed Thomas,present perfect,perfect
Google had interviewed Thomas,past perfect,perfect
Google will interview Thomas,future simple,progressive
Google interviews Thomas,present simple,progressive
Google interviewed Thomas,past simple,perfect
Google was hiring Thomas,past progressive,progressive
Google has hired Thomas,present perfect,perfect
Google had hired Thomas,past perfect,perfect
Google will hire Thomas,future simple,progressive
Google hires Thomas,present simple,progressive
Google hired Thomas,past simple,perfect
John is publishing the documentary,present progressive,progressive
John is filming the documentary,present progressive,progressive
John was filming the documentary,past progressive,progressive
John has filmed the documentary,present perfect,perfect
John had filmed the documentary,past perfect,perfect
John will film the documentary,future simple,progressive
John films the documentary,present simple,progressive
John filmed the documentary,past simple,perfect
John was publishing the documentary,past progressive,progressive
John has published the documentary,present perfect,perfect
John had published the documentary,past perfect,perfect
John will publish the documentary,future simple,progressive
John publishes the documentary,present simple,progressive
John published the documentary,past simple,perfect
Liverpool is winning against Arsenal,present progressive,progressive
Liverpool is competing with Arsenal,present progressive,progressive
Liverpool was competing with Arsenal,past progressive,progressive
Liverpool has competed with Arsenal,present perfect,perfect
Liverpool had competed with Arsenal,past perfect,perfect
Liverpool will compete with Arsenal,future simple,progressive
Liverpool competes with Arsenal,present simple,progressive
Liverpool competed with Arsenal,past simple,perfect
Liverpool was winning against Arsenal,past progressive,progressive
Liverpool has won against Arsenal,present perfect,perfect
Liverpool had won against Arsenal,past perfect,perfect
Liverpool will win against Arsenal,future simple,progressive
Liverpool wins against Arsenal,present simple,progressive
Liverpool won against Arsenal,past simple,perfect
Jane is seeking the file,present progressive,progressive
Jane has found the file,present perfect,perfect
Jane had found the file,past perfect,perfect
Jane will find the file,future simple,progressive
Jane finds the file,present simple,progressive
Jane found the file,past simple,perfect
Jane was seeking the file,past progressive,progressive
Jane has sought the file,present perfect,perfect
Jane had sought the file,past perfect,perfect
Jane will seek the file,future simple,progressive
Jane seeks the file,present simple,progressive
Jane sought the file,past simple,perfect
The police is prosecuting the thief,present progressive,progressive
The police is arresting the thief,present progressive,progressive
The police was arresting the thief,past progressive,progressive
The police has arrested the thief,present perfect,perfect
The police had arrested the thief,past perfect,perfect
The police will arrest the thief,future simple,progressive
The police arrests the thief,present simple,progressive
The police arrested the thief,past simple,perfect
The police was prosecuting the thief,past progressive,progressive
The police has prosecuted the thief,present perfect,perfect
The police had prosecuted the thief,past perfect,perfect
The police will prosecute the thief,future simple,progressive
The police prosecutes the thief,present simple,progressive
The police prosecuted the thief,past simple,perfect
Janet is sleeping,present progressive,progressive
Janet has awoken,present perfect,perfect
Janet had awoken,past perfect,perfect
Janet will awake,future simple,progressive
Janet awakes,present simple,progressive
Janet awoke,past simple,perfect
Janet was sleeping,past progressive,progressive
Janet has slept,present perfect,perfect
Janet had slept,past perfect,perfect
Janet will sleep,future simple,progressive
Janet sleeps,present simple,progressive
Janet slept,past simple,perfect
Peter is damaging the wall,present progressive,progressive
Peter is destroying the wall,present progressive,progressive
Peter was destroying the wall,past progressive,progressive
Peter has destroyed the wall,present perfect,perfect
Peter had destroyed the wall,past perfect,perfect
Peter will destroy the wall,future simple,progressive
Peter destroys the wall,present simple,progressive
Peter destroyed the wall,past simple,perfect
Peter was damaging the wall,past progressive,progressive
Peter has damaged the wall,present perfect,perfect
Peter had damaged the wall,past perfect,perfect
Peter will damage the wall,future simple,progressive
Peter damages the wall,present simple,progressive
Peter damaged the wall,past simple,perfect
Catherine is editing the documentary,present progressive,progressive
Catherine is filming the documentary,present progressive,progressive
Catherine was filming the documentary,past progressive,progressive
Catherine has filmed the documentary,present perfect,perfect
Catherine had filmed the documentary,past perfect,perfect
Catherine will film the documentary,future simple,progressive
Catherine films the documentary,present simple,progressive
Catherine filmed the documentary,past simple,perfect
Catherine was editing the documentary,past progressive,progressive
Catherine has edited the documentary,present perfect,perfect
Catherine had edited the documentary,past perfect,perfect
Catherine will edit the documentary,future simple,progressive
Catherine edits the documentary,present simple,progressive
Catherine edited the documentary,past simple,perfect
Jolene is meeting with Bill,present progressive,progressive
Jolene has agreed with Bill,present perfect,perfect
Jolene had agreed with Bill,past perfect,perfect
Jolene will agree with Bill,future simple,progressive
Jolene agrees with Bill,present simple,progressive
Jolene agreed with Bill,past simple,perfect
Jolene was meeting with Bill,past progressive,progressive
Jolene has met with Bill,present perfect,perfect
Jolene had met with Bill,past perfect,perfect
Jolene will meet with Bill,future simple,progressive
Jolene meets with Bill,present simple,progressive
Jolene met with Bill,past simple,perfect
The processor is compiling the program,present progressive,progressive
The processor is assembling the program,present progressive,progressive
The processor was assembling the program,past progressive,progressive
The processor has assembled the program,present perfect,perfect
The processor had assembled the program,past perfect,perfect
The processor will assemble the program,future simple,progressive
The processor assembles the program,present simple,progressive
The processor assembled the program,past simple,perfect
The processor was compiling the program,past progressive,progressive
The processor has compiled the program,present perfect,perfect
The processor had compiled the program,past perfect,perfect
The processor will compile the program,future simple,progressive
The processor compiles the program,present simple,progressive
The processor compiled the program,past simple,perfect
Anne has agreed with Barbara,present perfect,perfect
Anne is talking to Barbara,present progressive,progressive
Anne was talking to Barbara,past progressive,progressive
Anne has talked to Barbara,present perfect,perfect
Anne had talked to Barbara,past perfect,perfect
Anne will talk to Barbara,future simple,progressive
Anne talks to Barbara,present simple,progressive
Anne talked to Barbara,past simple,perfect
Anne had agreed with Barbara,past perfect,perfect
Anne will agree with Barbara,future simple,progressive
Anne agrees with Barbara,present simple,progressive
Anne agreed with Barbara,past simple,perfect
Jack is searching for the map,present progressive,progressive
Jack has found the map,present perfect,perfect
Jack had found the map,past perfect,perfect
Jack will find the map,future simple,progressive
Jack finds the map,present simple,progressive
Jack found the map,past simple,perfect
Jack was searching for the map,past progressive,progressive
Jack has searched for the map,present perfect,perfect
Jack had searched for the map,past perfect,perfect
Jack will search for the map,future simple,progressive
Jack searches for the map,present simple,progressive
Jack searched for the map,past simple,perfect
Russia is occupying Crimea,present progressive,progressive
Russia is annexing Crimea,present progressive,progressive
Russia was annexing Crimea,past progressive,progressive
Russia has annexed Crimea,present perfect,perfect
Russia had annexed Crimea,past perfect,perfect
Russia will annex Crimea,future simple,progressive
Russia annexes Crimea,present simple,progressive
Russia annexed Crimea,past simple,perfect
Russia was occupying Crimea,past progressive,progressive
Russia has occupied Crimea,present perfect,perfect
Russia had occupied Crimea,past perfect,perfect
Russia will occupy Crimea,future simple,progressive
Russia occupies Crimea,present simple,progressive
Russia occupied Crimea,past simple,perfect
Clyde is killing Keith,present progressive,progressive
Clyde is injuring Keith,present progressive,progressive
Clyde was injuring Keith,past progressive,progressive
Clyde has injured Keith,present perfect,perfect
Clyde had injured Keith,past perfect,perfect
Clyde will injure Keith,future simple,progressive
Clyde injures Keith,present simple,progressive
Clyde injured Keith,past simple,perfect
Clyde was killing Keith,past progressive,progressive
Clyde has killed Keith,present perfect,perfect
Clyde had killed Keith,past perfect,perfect
Clyde will kill Keith,future simple,progressive
Clyde kills Keith,present simple,progressive
Clyde killed Keith,past simple,perfect
Matt is writing the novel,present progressive,progressive
Matt is publishing the novel,present progressive,progressive
Matt was publishing the novel,past progressive,progressive
Matt has published the novel,present perfect,perfect
Matt had published the novel,past perfect,perfect
Matt will publish the novel,future simple,progressive
Matt publishes the novel,present simple,progressive
Matt published the novel,past simple,perfect
Matt was writing the novel,past progressive,progressive
Matt has written the novel,present perfect,perfect
Matt had written the novel,past perfect,perfect
Matt will write the novel,future simple,progressive
Matt writes the novel,present simple,progressive
Matt wrote the novel,past simple,perfect
Italy is attacking Spain,present progressive,progressive
Italy is occupying Spain,present progressive,progressive
Italy was occupying Spain,past progressive,progressive
Italy has occupied Spain,present perfect,perfect
Italy had occupied Spain,past perfect,perfect
Italy will occupy Spain,future simple,progressive
Italy occupies Spain,present simple,progressive
Italy occupied Spain,past simple,perfect
Italy was attacking Spain,past progressive,progressive
Italy has attacked Spain,present perfect,perfect
Italy had attacked Spain,past perfect,perfect
Italy will attack Spain,future simple,progressive
Italy attacks Spain,present simple,progressive
Italy attacked Spain,past simple,perfect
Norway is occupying Sweden,present progressive,progressive
Norway is bombing Sweden,present progressive,progressive
Norway was bombing Sweden,past progressive,progressive
Norway has bombed Sweden,present perfect,perfect
Norway had bombed Sweden,past perfect,perfect
Norway will bomb Sweden,future simple,progressive
Norway bombs Sweden,present simple,progressive
Norway bombed Sweden,past simple,perfect
Norway was occupying Sweden,past progressive,progressive
Norway has occupied Sweden,present perfect,perfect
Norway had occupied Sweden,past perfect,perfect
Norway will occupy Sweden,future simple,progressive
Norway occupies Sweden,present simple,progressive
Norway occupied Sweden,past simple,perfect
Mary is travelling to Borneo,present progressive,progressive
Mary is booking the ticket to Borneo,present progressive,progressive
Mary was booking the ticket to Borneo,past progressive,progressive
Mary has booked the ticket to Borneo,present perfect,perfect
Mary had booked the ticket to Borneo,past perfect,perfect
Mary will book the ticket to Borneo,future simple,progressive
Mary books the ticket to Borneo,present simple,progressive
Mary booked the ticket to Borneo,past simple,perfect
Mary was travelling to Borneo,past progressive,progressive
Mary has travelled to Borneo,present perfect,perfect
Mary had travelled to Borneo,past perfect,perfect
Mary will travel to Borneo,future simple,progressive
Mary travels to Borneo,present simple,progressive
Mary travelled to Borneo,past simple,perfect
Sheila is graduating from university,present progressive,progressive
Sheila is studying at university,present progressive,progressive
Sheila was studying at university,past progressive,progressive
Sheila has studied at university,present perfect,perfect
Sheila had studied at university,past perfect,perfect
Sheila will study at university,future simple,progressive
Sheila studies at university,present simple,progressive
Sheila studied at university,past simple,perfect
Sheila was graduating from university,past progressive,progressive
Sheila has graduated from university,present perfect,perfect
Sheila had graduated from university,past perfect,perfect
Sheila will graduate from university,future simple,progressive
Sheila graduates from university,present simple,progressive
Sheila graduated from university,past simple,perfect
Boeing is distributing the airplane,present progressive,progressive
Boeing is manufacturing the airplane,present progressive,progressive
Boeing was manufacturing the airplane,past progressive,progressive
Boeing has manufactured the airplane,present perfect,perfect
Boeing had manufactured the airplane,past perfect,perfect
Boeing will manufacture the airplane,future simple,progressive
Boeing manufactures the airplane,present simple,progressive
Boeing manufactured the airplane,past simple,perfect
Boeing was distributing the airplane,past progressive,progressive
Boeing has distributed the airplane,present perfect,perfect
Boeing had distributed the airplane,past perfect,perfect
Boeing will distribute the airplane,future simple,progressive
Boeing distributes the airplane,present simple,progressive
Boeing distributed the airplane,past simple,perfect
Theresa has owned the painting,present perfect,perfect
Theresa is stealing the painting,present progressive,progressive
Theresa was stealing the painting,past progressive,progressive
Theresa has stolen the painting,present perfect,perfect
Theresa had stolen the painting,past perfect,perfect
Theresa will steal the painting,future simple,progressive
Theresa steals the painting,present simple,progressive
Theresa stole the painting,past simple,perfect
Theresa had owned the painting,past perfect,perfect
Theresa will own the painting,future simple,progressive
Theresa owns the painting,present simple,progressive
Theresa owned the painting,past simple,perfect
Denmark is invading Finland,present progressive,progressive
Denmark is attacking Finland,present progressive,progressive
Denmark was attacking Finland,past progressive,progressive
Denmark has attacked Finland,present perfect,perfect
Denmark had attacked Finland,past perfect,perfect
Denmark will attack Finland,future simple,progressive
Denmark attacks Finland,present simple,progressive
Denmark attacked Finland,past simple,perfect
Denmark was invading Finland,past progressive,progressive
Denmark has invaded Finland,present perfect,perfect
Denmark had invaded Finland,past perfect,perfect
Denmark will invade Finland,future simple,progressive
Denmark invades Finland,present simple,progressive
Denmark invaded Finland,past simple,perfect
William is acquiring the desk,present progressive,progressive
William has had the desk,present perfect,perfect
William had had the desk,past perfect,perfect
William will have the desk,future simple,progressive
William has the desk,present simple,progressive
William had the desk,past simple,perfect
William was acquiring the desk,past progressive,progressive
William has acquired the desk,present perfect,perfect
William had acquired the desk,past perfect,perfect
William will acquire the desk,future simple,progressive
William acquires the desk,present simple,progressive
William acquired the desk,past simple,perfect
Karen is deciding on the issue,present progressive,progressive
Karen is negotiating the issue,present progressive,progressive
Karen was negotiating the issue,past progressive,progressive
Karen has negotiated the issue,present perfect,perfect
Karen had negotiated the issue,past perfect,perfect
Karen will negotiate the issue,future simple,progressive
Karen negotiates the issue,present simple,progressive
Karen negotiated the issue,past simple,perfect
Karen was deciding on the issue,past progressive,progressive
Karen has decided on the issue,present perfect,perfect
Karen had decided on the issue,past perfect,perfect
Karen will decide on the issue,future simple,progressive
Karen decides on the issue,present simple,progressive
Karen decided on the issue,past simple,perfect
Mike is choosing the computer,present progressive,progressive
Mike is buying the computer,present progressive,progressive
Mike was buying the computer,past progressive,progressive
Mike has bought the computer,present perfect,perfect
Mike had bought the computer,past perfect,perfect
Mike will buy the computer,future simple,progressive
Mike buys the computer,present simple,progressive
Mike bought the computer,past simple,perfect
Mike was choosing the computer,past progressive,progressive
Mike has chosen the computer,present perfect,perfect
Mike had chosen the computer,past perfect,perfect
Mike will choose the computer,future simple,progressive
Mike chooses the computer,present simple,progressive
Mike chose the computer,past simple,perfect
Lee is graduating from college,present progressive,progressive
Lee is enrolling in college,present progressive,progressive
Lee was enrolling in college,past progressive,progressive
Lee has enrolled in college,present perfect,perfect
Lee had enrolled in college,past perfect,perfect
Lee will enroll in college,future simple,progressive
Lee enrols in college,present simple,progressive
Lee enrolled in college,past simple,perfect
Lee was graduating from college,past progressive,progressive
Lee has graduated from college,present perfect,perfect
Lee had graduated from college,past perfect,perfect
Lee will graduate from college,future simple,progressive
Lee graduates from college,present simple,progressive
Lee graduated from college,past simple,perfect
Charles is leaving,present progressive,progressive
Charles is packing,present progressive,progressive
Charles was packing,past progressive,progressive
Charles has packed,present perfect,perfect
Charles had packed,past perfect,perfect
Charles will pack,future simple,progressive
Charles packs,present simple,progressive
Charles packed,past simple,perfect
Charles was leaving,past progressive,progressive
Charles has left,present perfect,perfect
Charles had left,past perfect,perfect
Charles will leave,future simple,progressive
Charles leaves,present simple,progressive
Charles left,past simple,perfect
Liverpool is competing against Arsenal,present progressive,progressive
Liverpool is challenging Arsenal,present progressive,progressive
Liverpool was challenging Arsenal,past progressive,progressive
Liverpool has challenged Arsenal,present perfect,perfect
Liverpool had challenged Arsenal,past perfect,perfect
Liverpool will challenge Arsenal,future simple,progressive
Liverpool challenges Arsenal,present simple,progressive
Liverpool challenged Arsenal,past simple,perfect
Liverpool was competing against Arsenal,past progressive,progressive
Liverpool has competed against Arsenal,present perfect,perfect
Liverpool had competed against Arsenal,past perfect,perfect
Liverpool will compete against Arsenal,future simple,progressive
Liverpool competes against Arsenal,present simple,progressive
Liverpool competed against Arsenal,past simple,perfect
Airbus is manufacturing the helicopter,present progressive,progressive
Airbus is selling the helicopter,present progressive,progressive
Airbus was selling the helicopter,past progressive,progressive
Airbus has sold the helicopter,present perfect,perfect
Airbus had sold the helicopter,past perfect,perfect
Airbus will sell the helicopter,future simple,progressive
Airbus sells the helicopter,present simple,progressive
Airbus sold the helicopter,past simple,perfect
Airbus was manufacturing the helicopter,past progressive,progressive
Airbus has manufactured the helicopter,present perfect,perfect
Airbus had manufactured the helicopter,past perfect,perfect
Airbus will manufacture the helicopter,future simple,progressive
Airbus manufactures the helicopter,present simple,progressive
Airbus manufactured the helicopter,past simple,perfect
Phil is collecting the sofa,present progressive,progressive
Phil has owned the sofa,present perfect,perfect
Phil had owned the sofa,past perfect,perfect
Phil will own the sofa,future simple,progressive
Phil owns the sofa,present simple,progressive
Phil owned the sofa,past simple,perfect
Phil was collecting the sofa,past progressive,progressive
Phil has collected the sofa,present perfect,perfect
Phil had collected the sofa,past perfect,perfect
Phil will collect the sofa,future simple,progressive
Phil collects the sofa,present simple,progressive
Phil collected the sofa,past simple,perfect
Barry is purchasing the bicycle,present progressive,progressive
Barry is choosing the bicycle,present progressive,progressive
Barry was choosing the bicycle,past progressive,progressive
Barry has chosen the bicycle,present perfect,perfect
Barry had chosen the bicycle,past perfect,perfect
Barry will choose the bicycle,future simple,progressive
Barry chooses the bicycle,present simple,progressive
Barry chose the bicycle,past simple,perfect
Barry was purchasing the bicycle,past progressive,progressive
Barry has purchased the bicycle,present perfect,perfect
Barry had purchased the bicycle,past perfect,perfect
Barry will purchase the bicycle,future simple,progressive
Barry purchases the bicycle,present simple,progressive
Barry purchased the bicycle,past simple,perfect
Nick is visiting London,present progressive,progressive
Nick is leaving London,present progressive,progressive
Nick was leaving London,past progressive,progressive
Nick has left London,present perfect,perfect
Nick had left London,past perfect,perfect
Nick will leave London,future simple,progressive
Nick leaves London,present simple,progressive
Nick left London,past simple,perfect
Nick was visiting London,past progressive,progressive
Nick has visited London,present perfect,perfect
Nick had visited London,past perfect,perfect
Nick will visit London,future simple,progressive
Nick visits London,present simple,progressive
Nick visited London,past simple,perfect
Amazon is shipping the order,present progressive,progressive
