"sentence,tense,aspect"
Amazon is dispatching the order,present progressive,progressive
Amazon was dispatching the order,past progressive,progressive
Amazon has dispatched the order,present perfect,perfect
Amazon had dispatched the order,past perfect,perfect
Amazon will dispatch the order,future simple,progressive
Amazon dispatches the order,present simple,progressive
Amazon dispatched the order,past simple,perfect
Amazon was shipping the order,past progressive,progressive
Amazon has shipped the order,present perfect,perfect
Amazon had shipped the order,past perfect,perfect
Amazon will ship the order,future simple,progressive
Amazon ships the order,present simple,progressive
Amazon shipped the order,past simple,perfect
Amazon is delivering the parcel,present progressive,progressive
Amazon was delivering the parcel,past progressive,progressive
Amazon has delivered the parcel,present perfect,perfect
Amazon had delivered the parcel,past perfect,perfect
Amazon will deliver the parcel,future simple,progressive
Amazon delivers the parcel,present simple,progressive
Amazon delivered the parcel,past simple,perfect
Jeremy has owned the certificate,present perfect,perfect
Jeremy is obtaining the certificate,present progressive,progressive
Jeremy was obtaining the certificate,past progressive,progressive
Jeremy has obtained the certificate,present perfect,perfect
Jeremy had obtained the certificate,past perfect,perfect
Jeremy will obtain the certificate,future simple,progressive
Jeremy obtains the certificate,present simple,progressive
Jeremy obtained the certificate,past simple,perfect
Jeremy had owned the certificate,past perfect,perfect
Jeremy will own the certificate,future simple,progressive
Jeremy owns the certificate,present simple,progressive
Jeremy owned the certificate,past simple,perfect
John is purchasing the truck,present progressive,progressive
John has had the truck,present perfect,perfect
John had had the truck,past perfect,perfect
John will have the truck,future simple,progressive
John has the truck,present simple,progressive
John had the truck,past simple,perfect
John was purchasing the truck,past progressive,progressive
John has purchased the truck,present perfect,perfect
John had purchased the truck,past perfect,perfect
John will purchase the truck,future simple,progressive
John purchases the truck,present simple,progressive
John purchased the truck,past simple,perfect
Kim is obtaining the degree,present progressive,progressive
Kim has had the degree,present perfect,perfect
Kim had had the degree,past perfect,perfect
Kim will have the degree,future simple,progressive
Kim has the degree,present simple,progressive
Kim had the degree,past simple,perfect
Kim was obtaining the degree,past progressive,progressive
Kim has obtained the degree,present perfect,perfect
Kim had obtained the degree,past perfect,perfect
Kim will obtain the degree,future simple,progressive
Kim obtains the degree,present simple,progressive
Kim obtained the degree,past simple,perfect
Steve is proposing to Elizabeth,present progressive,progressive
Steve is marrying Elizabeth,present progressive,progressive
Steve was marrying Elizabeth,past progressive,progressive
Steve has married Elizabeth,present perfect,perfect
Steve had married Elizabeth,past perfect,perfect
Steve will marry Elizabeth,future simple,progressive
Steve marries Elizabeth,present simple,progressive
Steve married Elizabeth,past simple,perfect
Steve was proposing to Elizabeth,past progressive,progressive
Steve has proposed to Elizabeth,present perfect,perfect
Steve had proposed to Elizabeth,past perfect,perfect
Steve will propose to Elizabeth,future simple,progressive
Steve proposes to Elizabeth,present simple,progressive
Steve proposed to Elizabeth,past simple,perfect
Airbus is shipping the airplane,present progressive,progressive
Airbus is manufacturing the airplane,present progressive,progressive
Airbus was manufacturing the airplane,past progressive,progressive
Airbus has manufactured the airplane,present perfect,perfect
Airbus had manufactured the airplane,past perfect,perfect
Airbus will manufacture the airplane,future simple,progressive
Airbus manufactures the airplane,present simple,progressive
Airbus manufactured the airplane,past simple,perfect
Airbus was shipping the airplane,past progressive,progressive
Airbus has shipped the airplane,present perfect,perfect
Airbus had shipped the airplane,past perfect,perfect
Airbus will ship the airplane,future simple,progressive
Airbus ships the airplane,present simple,progressive
Airbus shipped the airplane,past simple,perfect
Amazon is bundling the order,present progressive,progressive
Amazon is distributing the order,present progressive,progressive
Amazon was distributing the order,past progressive,progressive
Amazon has distributed the order,present perfect,perfect
Amazon had distributed the order,past perfect,perfect
Amazon will distribute the order,future simple,progressive
Amazon distributes the order,present simple,progressive
Amazon distributed the order,past simple,perfect
Amazon was bundling the order,past progressive,progressive
Amazon has bundled the order,present perfect,perfect
Amazon had bundled the order,past perfect,perfect
Amazon will bundle the order,future simple,progressive
Amazon bundles the order,present simple,progressive
Amazon bundled the order,past simple,perfect
Greece is invading Egypt,present progressive,progressive
Greece is occupying Egypt,present progressive,progressive
Greece was occupying Egypt,past progressive,progressive
Greece has occupied Egypt,present perfect,perfect
Greece had occupied Egypt,past perfect,perfect
Greece will occupy Egypt,future simple,progressive
Greece occupies Egypt,present simple,progressive
Greece occupied Egypt,past simple,perfect
Greece was invading Egypt,past progressive,progressive
Greece has invaded Egypt,present perfect,perfect
Greece had invaded Egypt,past perfect,perfect
Greece will invade Egypt,future simple,progressive
Greece invades Egypt,present simple,progressive
Greece invaded Egypt,past simple,perfect
Ed has had the painting,present perfect,perfect
Ed is stealing the painting,present progressive,progressive
Ed was stealing the painting,past progressive,progressive
Ed has stolen the painting,present perfect,perfect
Ed had stolen the painting,past perfect,perfect
Ed will steal the painting,future simple,progressive
Ed steals the painting,present simple,progressive
Ed stole the painting,past simple,perfect
Ed had had the painting,past perfect,perfect
Ed will have the painting,future simple,progressive
Ed has the painting,present simple,progressive
Ed had the painting,past simple,perfect
Liverpool is losing against Arsenal,present progressive,progressive
Liverpool was losing against Arsenal,past progressive,progressive
Liverpool has lost against Arsenal,present perfect,perfect
Liverpool had lost against Arsenal,past perfect,perfect
Liverpool will lose against Arsenal,future simple,progressive
Liverpool loses against Arsenal,present simple,progressive
Liverpool lost against Arsenal,past simple,perfect
Poland is controlling Warsaw,present progressive,progressive
Poland is conquering Warsaw,present progressive,progressive
Poland was conquering Warsaw,past progressive,progressive
Poland has conquered Warsaw,present perfect,perfect
Poland had conquered Warsaw,past perfect,perfect
Poland will conquer Warsaw,future simple,progressive
Poland conquers Warsaw,present simple,progressive
Poland conquered Warsaw,past simple,perfect
Poland was controlling Warsaw,past progressive,progressive
Poland has controlled Warsaw,present perfect,perfect
Poland had controlled Warsaw,past perfect,perfect
Poland will control Warsaw,future simple,progressive
Poland controls Warsaw,present simple,progressive
Poland controlled Warsaw,past simple,perfect
Peru is invading Bolivia,present progressive,progressive
Peru is conquering Bolivia,present progressive,progressive
Peru was conquering Bolivia,past progressive,progressive
Peru has conquered Bolivia,present perfect,perfect
Peru had conquered Bolivia,past perfect,perfect
Peru will conquer Bolivia,future simple,progressive
Peru conquers Bolivia,present simple,progressive
Peru conquered Bolivia,past simple,perfect
Peru was invading Bolivia,past progressive,progressive
Peru has invaded Bolivia,present perfect,perfect
Peru had invaded Bolivia,past perfect,perfect
Peru will invade Bolivia,future simple,progressive
Peru invades Bolivia,present simple,progressive
Peru invaded Bolivia,past simple,perfect
Airbus is producing the airplane,present progressive,progressive
Airbus is supplying the airplane,present progressive,progressive
Airbus was supplying the airplane,past progressive,progressive
Airbus has supplied the airplane,present perfect,perfect
Airbus had supplied the airplane,past perfect,perfect
Airbus will supply the airplane,future simple,progressive
Airbus supplies the airplane,present simple,progressive
Airbus supplied the airplane,past simple,perfect
Airbus was producing the airplane,past progressive,progressive
Airbus has produced the airplane,present perfect,perfect
Airbus had produced the airplane,past perfect,perfect
Airbus will produce the airplane,future simple,progressive
Airbus produces the airplane,present simple,progressive
Airbus produced the airplane,past simple,perfect
Paul is buying groceries,present progressive,progressive
Paul is paying for groceries,present progressive,progressive
Paul was paying for groceries,past progressive,progressive
Paul has paid for groceries,present perfect,perfect
Paul had paid for groceries,past perfect,perfect
Paul will pay for groceries,future simple,progressive
Paul pays for groceries,present simple,progressive
Paul paid for groceries,past simple,perfect
Paul was buying groceries,past progressive,progressive
Paul has bought groceries,present perfect,perfect
Paul had bought groceries,past perfect,perfect
Paul will buy groceries,future simple,progressive
Paul buys groceries,present simple,progressive
Paul bought groceries,past simple,perfect
Boeing is developing the helicopter,present progressive,progressive
Boeing is designing the helicopter,present progressive,progressive
Boeing was designing the helicopter,past progressive,progressive
Boeing has designed the helicopter,present perfect,perfect
Boeing had designed the helicopter,past perfect,perfect
Boeing will design the helicopter,future simple,progressive
Boeing designs the helicopter,present simple,progressive
Boeing designed the helicopter,past simple,perfect
Boeing was developing the helicopter,past progressive,progressive
Boeing has developed the helicopter,present perfect,perfect
Boeing had developed the helicopter,past perfect,perfect
Boeing will develop the helicopter,future simple,progressive
Boeing develops the helicopter,present simple,progressive
Boeing developed the helicopter,past simple,perfect
Anne is inventing the machine,present progressive,progressive
Anne is developing the machine,present progressive,progressive
Anne was developing the machine,past progressive,progressive
Anne has developed the machine,present perfect,perfect
Anne had developed the machine,past perfect,perfect
Anne will develop the machine,future simple,progressive
Anne develops the machine,present simple,progressive
Anne developed the machine,past simple,perfect
Anne was inventing the machine,past progressive,progressive
Anne has invented the machine,present perfect,perfect
Anne had invented the machine,past perfect,perfect
Anne will invent the machine,future simple,progressive
Anne invents the machine,present simple,progressive
Anne invented the machine,past simple,perfect
Jack will take the apple,future simple,progressive
Jack is buying the apple,present progressive,progressive
Jack was buying the apple,past progressive,progressive
Jack has bought the apple,present perfect,perfect
Jack had bought the apple,past perfect,perfect
Jack will buy the apple,future simple,progressive
Jack buys the apple,present simple,progressive
Jack bought the apple,past simple,perfect
Jack takes the apple,present simple,progressive
Jack took the apple,past simple,perfect
John is visiting London,present progressive,progressive
John is arriving in London,present progressive,progressive
John was arriving in London,past progressive,progressive
John has arrived in London,present perfect,perfect
John had arrived in London,past perfect,perfect
John will arrive in London,future simple,progressive
John arrives in London,present simple,progressive
John arrived in London,past simple,perfect
John was visiting London,past progressive,progressive
John has visited London,present perfect,perfect
John had visited London,past perfect,perfect
John will visit London,future simple,progressive
John visits London,present simple,progressive
John visited London,past simple,perfect
Phil is marrying Jane,present progressive,progressive
Phil is divorcing Jane,present progressive,progressive
Phil was divorcing Jane,past progressive,progressive
Phil has divorced Jane,present perfect,perfect
Phil had divorced Jane,past perfect,perfect
Phil will divorce Jane,future simple,progressive
Phil divorces Jane,present simple,progressive
Phil divorced Jane,past simple,perfect
Phil was marrying Jane,past progressive,progressive
Phil has married Jane,present perfect,perfect
Phil had married Jane,past perfect,perfect
Phil will marry Jane,future simple,progressive
Phil marries Jane,present simple,progressive
Phil married Jane,past simple,perfect
Eileen is acquiring the estate,present progressive,progressive
Eileen is choosing the estate,present progressive,progressive
Eileen was choosing the estate,past progressive,progressive
Eileen has chosen the estate,present perfect,perfect
Eileen had chosen the estate,past perfect,perfect
Eileen will choose the estate,future simple,progressive
Eileen chooses the estate,present simple,progressive
Eileen chose the estate,past simple,perfect
Eileen was acquiring the estate,past progressive,progressive
Eileen has acquired the estate,present perfect,perfect
Eileen had acquired the estate,past perfect,perfect
Eileen will acquire the estate,future simple,progressive
Eileen acquires the estate,present simple,progressive
Eileen acquired the estate,past simple,perfect
Jim is dialling 911,present progressive,progressive
Jim is phoning 911,present progressive,progressive
Jim was phoning 911,past progressive,progressive
Jim has phoned 911,present perfect,perfect
Jim had phoned 911,past perfect,perfect
Jim will phone 911,future simple,progressive
Jim phones 911,present simple,progressive
Jim phoned 911,past simple,perfect
Jim was dialling 911,past progressive,progressive
Jim has dialled 911,present perfect,perfect
Jim had dialled 911,past perfect,perfect
Jim will dial 911,future simple,progressive
Jim dials 911,present simple,progressive
Jim dialled 911,past simple,perfect
Mark is leaving the restaurant,present progressive,progressive
Mark is entering the restaurant,present progressive,progressive
Mark was entering the restaurant,past progressive,progressive
Mark has entered the restaurant,present perfect,perfect
Mark had entered the restaurant,past perfect,perfect
Mark will enter the restaurant,future simple,progressive
Mark enters the restaurant,present simple,progressive
Mark entered the restaurant,past simple,perfect
Mark was leaving the restaurant,past progressive,progressive
Mark has left the restaurant,present perfect,perfect
Mark had left the restaurant,past perfect,perfect
Mark will leave the restaurant,future simple,progressive
Mark leaves the restaurant,present simple,progressive
Mark left the restaurant,past simple,perfect
The farmer is harvesting the crops,present progressive,progressive
The farmer is shipping the crops,present progressive,progressive
The farmer was shipping the crops,past progressive,progressive
The farmer has shipped the crops,present perfect,perfect
The farmer had shipped the crops,past perfect,perfect
The farmer will ship the crops,future simple,progressive
The farmer ships the crops,present simple,progressive
The farmer shipped the crops,past simple,perfect
The farmer was harvesting the crops,past progressive,progressive
The farmer has harvested the crops,present perfect,perfect
The farmer had harvested the crops,past perfect,perfect
The farmer will harvest the crops,future simple,progressive
The farmer harvests the crops,present simple,progressive
The farmer harvested the crops,past simple,perfect
Nigel is overthrowing the government,present progressive,progressive
Nigel is destabilising the government,present progressive,progressive
Nigel was destabilising the government,past progressive,progressive
Nigel has destabilised the government,present perfect,perfect
Nigel had destabilised the government,past perfect,perfect
Nigel will destabilise the government,future simple,progressive
Nigel destabilises the government,present simple,progressive
Nigel destabilised the government,past simple,perfect
Nigel was overthrowing the government,past progressive,progressive
Nigel has overthrown the government,present perfect,perfect
Nigel had overthrown the government,past perfect,perfect
Nigel will overthrow the government,future simple,progressive
Nigel overthrows the government,present simple,progressive
Nigel overthrew the government,past simple,perfect
Liverpool is beating Arsenal,present progressive,progressive
Liverpool was beating Arsenal,past progressive,progressive
Liverpool has beaten Arsenal,present perfect,perfect
Liverpool had beaten Arsenal,past perfect,perfect
Liverpool will beat Arsenal,future simple,progressive
Liverpool beats Arsenal,present simple,progressive
Liverpool beat Arsenal,past simple,perfect
Kevin is breaking the board,present progressive,progressive
Kevin is cracking the board,present progressive,progressive
Kevin was cracking the board,past progressive,progressive
Kevin has cracked the board,present perfect,perfect
Kevin had cracked the board,past perfect,perfect
Kevin will crack the board,future simple,progressive
Kevin cracks the board,present simple,progressive
Kevin cracked the board,past simple,perfect
Kevin was breaking the board,past progressive,progressive
Kevin has broken the board,present perfect,perfect
Kevin had broken the board,past perfect,perfect
Kevin will break the board,future simple,progressive
Kevin breaks the board,present simple,progressive
Kevin broke the board,past simple,perfect
Boeing has had the helicopter,present perfect,perfect
Boeing is manufacturing the helicopter,present progressive,progressive
Boeing was manufacturing the helicopter,past progressive,progressive
Boeing has manufactured the helicopter,present perfect,perfect
Boeing had manufactured the helicopter,past perfect,perfect
Boeing will manufacture the helicopter,future simple,progressive
Boeing manufactures the helicopter,present simple,progressive
Boeing manufactured the helicopter,past simple,perfect
Boeing had had the helicopter,past perfect,perfect
Boeing will have the helicopter,future simple,progressive
Boeing has the helicopter,present simple,progressive
Boeing had the helicopter,past simple,perfect
Boeing has owned the helicopter,present perfect,perfect
Boeing had owned the helicopter,past perfect,perfect
Boeing will own the helicopter,future simple,progressive
Boeing owns the helicopter,present simple,progressive
Boeing owned the helicopter,past simple,perfect
Liverpool is playing against Arsenal,present progressive,progressive
Liverpool was playing against Arsenal,past progressive,progressive
Liverpool has played against Arsenal,present perfect,perfect
Liverpool had played against Arsenal,past perfect,perfect
Liverpool will play against Arsenal,future simple,progressive
Liverpool plays against Arsenal,present simple,progressive
Liverpool played against Arsenal,past simple,perfect
Mary is acquiring the dress,present progressive,progressive
Mary will take the dress,future simple,progressive
Mary takes the dress,present simple,progressive
Mary took the dress,past simple,perfect
Mary was acquiring the dress,past progressive,progressive
Mary has acquired the dress,present perfect,perfect
Mary had acquired the dress,past perfect,perfect
Mary will acquire the dress,future simple,progressive
Mary acquires the dress,present simple,progressive
Mary acquired the dress,past simple,perfect
Liverpool is defeating Arsenal,present progressive,progressive
Liverpool was defeating Arsenal,past progressive,progressive
Liverpool has defeated Arsenal,present perfect,perfect
Liverpool had defeated Arsenal,past perfect,perfect
Liverpool will defeat Arsenal,future simple,progressive
Liverpool defeats Arsenal,present simple,progressive
Liverpool defeated Arsenal,past simple,perfect
Jane has owned the furniture,present perfect,perfect
Jane is paying for the furniture,present progressive,progressive
Jane was paying for the furniture,past progressive,progressive
Jane has paid for the furniture,present perfect,perfect
Jane had paid for the furniture,past perfect,perfect
Jane will pay for the furniture,future simple,progressive
Jane pays for the furniture,present simple,progressive
Jane paid for the furniture,past simple,perfect
Jane had owned the furniture,past perfect,perfect
Jane will own the furniture,future simple,progressive
Jane owns the furniture,present simple,progressive
Jane owned the furniture,past simple,perfect
John will take the shoes,future simple,progressive
John is purchasing the shoes,present progressive,progressive
John was purchasing the shoes,past progressive,progressive
John has purchased the shoes,present perfect,perfect
John had purchased the shoes,past perfect,perfect
John will purchase the shoes,future simple,progressive
John purchases the shoes,present simple,progressive
John purchased the shoes,past simple,perfect
John takes the shoes,present simple,progressive
John took the shoes,past simple,perfect
Boeing is producing the engine,present progressive,progressive
Boeing has had the engine,present perfect,perfect
Boeing had had the engine,past perfect,perfect
Boeing will have the engine,future simple,progressive
Boeing has the engine,present simple,progressive
Boeing had the engine,past simple,perfect
Boeing was producing the engine,past progressive,progressive
Boeing has produced the engine,present perfect,perfect
Boeing had produced the engine,past perfect,perfect
Boeing will produce the engine,future simple,progressive
Boeing produces the engine,present simple,progressive
Boeing produced the engine,past simple,perfect
Lee is killing the president,present progressive,progressive
Lee is attacking the president,present progressive,progressive
Lee was attacking the president,past progressive,progressive
Lee has attacked the president,present perfect,perfect
Lee had attacked the president,past perfect,perfect
Lee will attack the president,future simple,progressive
Lee attacks the president,present simple,progressive
Lee attacked the president,past simple,perfect
Lee was killing the president,past progressive,progressive
Lee has killed the president,present perfect,perfect
Lee had killed the president,past perfect,perfect
Lee will kill the president,future simple,progressive
Lee kills the president,present simple,progressive
Lee killed the president,past simple,perfect
Thomas is cooking soup,present progressive,progressive
Thomas is eating soup,present progressive,progressive
Thomas was eating soup,past progressive,progressive
Thomas has eaten soup,present perfect,perfect
Thomas had eaten soup,past perfect,perfect
Thomas will eat soup,future simple,progressive
Thomas eats soup,present simple,progressive
Thomas ate soup,past simple,perfect
Thomas was cooking soup,past progressive,progressive
Thomas has cooked soup,present perfect,perfect
Thomas had cooked soup,past perfect,perfect
Thomas will cook soup,future simple,progressive
Thomas cooks soup,present simple,progressive
Thomas cooked soup,past simple,perfect
The farmer has had the crops,present perfect,perfect
The farmer had had the crops,past perfect,perfect
The farmer will have the crops,future simple,progressive
The farmer has the crops,present simple,progressive
The farmer had the crops,past simple,perfect
Max is sleeping,present progressive,progressive
Max is dreaming,present progressive,progressive
Max was dreaming,past progressive,progressive
Max has dreamed,present perfect,perfect
Max had dreamed,past perfect,perfect
Max will dream,future simple,progressive
Max dreams,present simple,progressive
Max dreamed,past simple,perfect
Max was sleeping,past progressive,progressive
Max has slept,present perfect,perfect
Max had slept,past perfect,perfect
Max will sleep,future simple,progressive
Max sleeps,present simple,progressive
Max slept,past simple,perfect
Adam is discovering the comet,present progressive,progressive
Adam is searching for the comet,present progressive,progressive
Adam was searching for the comet,past progressive,progressive
Adam has searched for the comet,present perfect,perfect
Adam had searched for the comet,past perfect,perfect
Adam will search for the comet,future simple,progressive
Adam searches for the comet,present simple,progressive
Adam searched for the comet,past simple,perfect
Adam was discovering the comet,past progressive,progressive
Adam has discovered the comet,present perfect,perfect
Adam had discovered the comet,past perfect,perfect
Adam will discover the comet,future simple,progressive
Adam discovers the comet,present simple,progressive
